id,name,thread1225,Go to 15-3 if you chose B in 7-10 or B or C in 7-13 and,did not choose B in 14-5
1226,Go to 15-6 if you chose B in 14-5,"_______________________________________________________________________________第十五章　「遊園地」                            　    　　                 15-2変わり果てたシビル救出                               (Nightmare amusement park)Chapter 15   ""Amusement Park""Rescue of transformed Cybil"
1227,Page 1 (Nightmare amusement park),"I arrive at the amusement park by going through the sewers.In the amusement park, which has changed to the form of the otherworld,several of the attractions run constantly as if they were broken toys."
1228,Page 2 (Merry-go-round entrance),"I pass by the Ferris wheel, and arrive at the merry-go-round.However, only this attraction is not running."
1229,Page 3,"While it is only natural for a ride to not be in operation, it seemsunnatural for this merry-go-round to not be running...I walk around it."
1230,Page 4,Clink...Clink... (Onomatopoeia for walking sounds)While slipping between the horses I look for Cybil.Quite a bit of time has passed since she came here.
1231,Page 5,I suppose maybe she didn't find Cheryl and headed back to that ship.But the only way to get here is through those sewers.If she had gone back then we should have ran across each other at some point.
1232,Page 6,"""Huh...what is this...?""I slowly kneel down and try touching it.The dark green liquid is still warm.Something moved through here, and if this trail is traced it will lead backto the source of the liquid.第十五章　「遊園地」「シビルの後姿」Chapter 15   ""Amusement Park""Cybil, from behind"
1233,Page 7 (Cybil in wheelchair),And then...in the darkness I see Cybil from behind.
1234,Page 8,"""Cybil...""I try calling out to her.Only the low sound of the motor of the Ferris wheel echoes from afar.She should be able to hear me.I take another look at her.Movie: Monster Cybil stands up from the wheelchair"
1235,Page 9 Black,She slowly stood up from the wheelchair.
1236,Page 10,"Odd.I do not see the brave attitude that was present in her just before.She walks as if something has drained the life out of her, like sheis wandering about for no reason.I approach her.And call out to her once more."
1237,"Page 11 (Cybil standing, black background)","As I do this Cybil staggers as she slowly turns, and confirms my presence."
1238,Page 12,"And then, as if I am watching her in slow motion she raises her right armuntil it is parallel with the ground and then a bullet fires from thehandgun she is holding."
1239,"Page 13 (Cybil with arm raised, black background)","""Cybil, it's me. It's Harry!""The bullet grazes my shoulder, and with a discordant metallic sound ithits one of the wooden horses....She is coming towards me."
1240,Page 14,"Her eyes no longer appear to be human.The eerie red color of her eyes does not make it look like her life-force hasbeen drained, but instead, it makes it appear as if she has been possessed bysome evil being."
1241,Page 15 (Close up of Monster Cybil),"I was too late, I think.Her heart had been devoured by someone, no by Alessa.What is there is no longer Cybil.Just an alter-ego of Alessa that is using Cybil's body...第十五章　「遊園地」「ペットボトル」Chapter 15   ""Amusement ParkPet Bottle"
1242,Page 16,At that time I remembered.I searched my pockets...got it.The pet bottle.The vermilion liquid is inside it.I scooped it up in the hospital.
1243,Page 17,The red of Cybil's eyes looked a lot like the red of that liquid.I hold up the pet bottle so that Cybil can see it and shake it left and right.
1244,Page 18,"And then just for a moment her expression changed to one of imploring...She must be aware.But she seems to be caught on an edge in her body, her body that will not doher bidding."
1245,Page 19,"It is like she is being attracted to me...With her gun ready, Cybil approaches.Upon closer inspection I can see that her eyes are full of tears."
1246,Page 20,"I unscrew the cap of the pet bottle.No one is riding the wooden horses, so their speed increases.I think that it is like time is rapidly passing for everything but thetwo of us."
1247,Page 21,At the same time as the hammer falls in Cybil's gun with a 'click' Isprinkle the liquid in the pet bottle on Cybil without leaving a drop inside.
1248,Page 22 (Black),"""Gu...""Cybil tries to speak, and her face twists agonizingly.At the same time white smoke rises from her entire body, and gravitypulls her to the ground, face down."
1249,Page 23,And then a creepy creature that is shaped like a human organ burrows up outof Cybil's back and approaches my feet. I forcefully crush it under myfoot with all my might.
1250,Page 24,........................
1251,Page 25 (Cybil on ground) (Harry appears),"""Cybil! Wake up! Snap out of it!""Cybil doesn't respond.""Cybil!""........................After a bit Cybil opened her eyes.Her eyes are a calm blue."
1252,Page 26,"""...Harry?...What...happened?""""Shh...Don't talk.I'll take care of you.""A look of relief appears on her face and then she closes her eyes again."
1253,Page 27,"Once I am done binding her wound, I close my eyes as well, and place myhand on Cybil's shoulder."
1254,Page 28,...............
1255,Page 29 (Black),(Harry...Why did they take your daughter?Why her?)
1256,Page 30,"(I'm not sure, myself.But, you know, Cheryl isn't my biological daughter.)"
1257,Page 31,"(I actually haven't told her yet.She probably already knows anyway, though.)"
1258,Page 32,(We found her abandoned on the side of the highway.She was still a baby and nobody knew where she came from.)
1259,Page 33,"(We didn't have any kids of our own. My wife was sick, and it didn't looklike she was getting any better.So we took Cheryl in.)"
1260,Page 34,(So in that case...)
1261,Page 35,(There might be some connection between Cheryl and this town.)
1262,Page 36,(So what do you do now?)
1263,Page 37,(Cheryl is my daughter.I will save her. No matter what.)
1264,Page 38,"I slowly open my eyes.第十五章　「遊園地」 Amusement Park「闇に浮かぶアレッサ」Chapter 15   ""Amusement Park""Alessa appears in the darkness"
1265,Page 39 (Alessa in nightmare amusement park),"And then just as I had predicted, she appeared.Alessa.The girl that wrapped up this town and its residents in her otherworld."
1266,Page 40,"That girl carefully formed her body from out of light, and appeared rightin front of me.I begin to talk to that demon."
1267,Page 41,"""I figured you'd show.Hold it right there.I don't know who you are, what you're trying to do, and I don't care.Just one thing.Let Cheryl go.That's all I ask."""
1268,Page 42,Before I finish speaking Alessa raises her right hand toward the sky.
1269,Page 43,"And then she brings her arm down and my entire body is blown backwards.My body tumbles across the ground like a rag for about 30 meters, and thenfinally comes to a rest."
1270,Page 44,"""Damn!""Such incredible power.A servant of god, a demon's power.A normal person like me has no chance against her.Power is gushing out of her body, and it emits a pale light. I cannot evenapproach her."
1271,Page 45 (Spinning Flauros),"""Huh? What is this?""Suddenly a blinding light emits from my pocket.It is that four-sided object, the Flauros.Light shoots out in a straight line from each of the points of its triangles,and it eventually rises up into the air."
1272,Page 46,"Just as I thought that the great light and sound it was wrapped in meant thatits power was greater than Alessa's, the power of the Flauros condensed,became a beam of light, and pierced Alessa's body."
1273,Page 47 (Nightmare amusement park floor) (Alessa appears),"Just as I was just before, Alessa was blown backwards by that power, whichshe could not overcome."
1274,Page 48,"""Where's Cheryl? Give me back my daughter.""I was on the verge of passing out, and I thought of Cheryl.All I can do is calmly look at the unbelievable sight before me as it unfoldsbefore my eyes."
1275,Page 49,"What just happened? Is Cheryl okay?However, she does not answer me.Instead, a hoarse voice passes into my thoughts, and it is accompanied bythe sound of footsteps."
1276,Page 50 (Dahlia appears),"""We meet at last, Alessa.""""......!""""Dahlia  Gillespie......"""
1277,Page 51,Unable to move from my prone position I thought about who's voice that was.And then using all my strength I stand.After confirming that it was Dahlia in front of me I spoke in a voice thatwas nearly a yell.
1278,Page 52,"""Where's Cheryl? Where is she?"""
1279,Page 53,"Dahlia does not hear me yelling.She does not look back, and looks at Alessa with a creepy smile."
1280,Page 54,"""Alessa. This is the end of your little game.""""Mama...""Mother...? I am confused.""Huh? Could she be...?"""
1281,Page 55,"""You've been a ghastly little pest, haven't you? Alessa?I was careless. Thinking you couldn't escape from our spell."
1282,Page 56,"But Mommy didn't know how much you'd grown.That's why I couldn't catch you all by myself.But what a pity, yes?Now you're half indebted to this man for his help."""
1283,Page 57,"""Hey! What are you talking about?""My voice just echoes emptily in the darkness."
1284,Go to 15-4,"_______________________________________________________________________________第十五章　「遊園地」                            　    　　                 15-3変わり果てたシビルに発砲                             (Nightmare amusement park)Chapter 15   ""Amusement Park""Firing at transformed Cybil"
1285,Page 1 (Nightmare amusement park),"I arrive at the amusement park by going through the sewers.In the amusement park, which has changed to the form of the otherworld,several of the attractions run constantly as if they were broken toys."
1286,Page 2 (Merry-go-round entrance),"I pass by the Ferris wheel, and arrive at the merry-go-round.But, this is the only attraction that is not running."
1287,Page 3,"While it is only natural for a ride to not be in operation, it seemsunnatural for this merry-go-round to not be running...I walk around it."
1288,Page 4,Clink...Clink... (Onomatopoeia for walking sounds)While slipping between the horses I look for Cybil.Quite a bit of time has passed since she came here.
1289,Page 5,I suppose maybe she didn't find Cheryl and headed back to that ship.But the only way to get here is through those sewers.If she had gone back then we should have ran across each other at some point.
1290,Page 6,"""Huh...what is this...?""I slowly kneel down and try touching it.The dark green liquid is still warm.Something moved through here, and if this trail is traced it will lead backto the source of the liquid.第十五章　「遊園地」「闇とシビル」Chapter 15   ""Amusement Park""Darkness and Cybil"
1291,Page 7 (Cybil in wheelchair),And then...in the darkness I see Cybil from behind.
1292,Page 8,"""Cybil...""I try calling out to her.Only the low sound of the motor of the Ferris wheel echoes from afar.She should be able to hear me.I take another look at her.Movie: Monster Cybil stands up from the wheelchair"
1293,Page 9 Black,"Odd.I do not see the brave attitude that was present in her just before.She walks as if something has drained the life out of her, like sheis wandering about for no reason.I approach her.And call out to her once more."
1294,"Page 10 (Cybil standing, black background)","As I do this Cybil staggers as she slowly turns, and confirms my presence."
1295,Page 11,"And then, as if I am watching her in slow motion she raises her right armuntil it is parallel with the ground and then a bullet fires from thehandgun she is holding."
1296,"Page 12 (Cybil with arm raised, black background)","""Cybil, it's me. It's Harry!""The bullet grazes my shoulder, and with a discordant metallic sound ithits one of the wooden horses....She is coming towards me."
1297,Page 13,"Her eyes no longer appear to be human.The eerie red color of her eyes does not make it look like her life-force hasbeen drained, but instead, it makes it appear as if she has been possessed bysome evil being."
1298,Page 14 (Close up of Monster Cybil),"I was too late, I think.Her heart had been devoured by someone, no by Alessa.What is there is no longer Cybil.Just an alter-ego of Alessa that is using Cybil's body...第十五章　「遊園地」「シビルを撃つ」Chapter 15   ""Amusement Park""Harry shoots Cybil"
1299,Page 15,I ready my handgun and fire it at Cybil.I have no choice. If I do not fire then I will be killed.If I die then I won't be able to save Cheryl or anything.
1300,Page 16,"""Cybil...""She should be my most dependable partner.The first person I met in town and a supporter.An irreplaceable friend that risked her life to help me search for Cheryl."
1301,Page 17,"And now I am going to kill her in the name of rescuing my daughter.However, I have no choice.I will be killed if I do nothing.I pull the trigger."
1302,Page 18 (Red),Each time I hit Cybil I feel like I am going to pass out.And as Cybil collapses I become aware of my error.
1303,"Page 19 (Cybil, dead on the floor)",Cybil has become just an object.I rush over to Cybil and look at her. She is on her back with her eyes wideopen. I sink to the ground.Tears distort my vision.
1304,Page 20,"""Cybil...why...did this happen...""At the moment I am about to touch Cybil her back suddenly rises andbegins squirming."
1305,Page 21,"A nasty liquid-like monster bursts out of Cybil's lifeless back.It crawls on the floor, and begins to move at a speed not unthinkable for itsshape."
1306,Page 22,"Keeping only it in my sight, I pursue it.I am already exhausted, and maybe in no condition to correctly judge things.第十五章　「遊園地」「アレッサ出現」Chapter 15   ""Amusement Park""The appearance of Alessa"
1307,Page 23 (Alessa in nightmare amusement park),"And then just as I had predicted, she appeared.Alessa.The girl that wrapped up this town and its residents in her otherworld."
1308,Page 24,"That girl carefully formed her body from out of light, and appeared rightin front of me.I begin to talk to that demon."
1309,Page 25,"""I figured you'd show.Hold it right there.I don't know who you are, what you're trying to do, and I don't care.Just one thing.Let Cheryl go.That's all I ask."""
1310,Page 26,Before I finish speaking Alessa raises her right hand toward the sky.
1311,Page 27,"And then she brings her arm down and my entire body is blown backwards.My body tumbles across the ground like a rag for about 30 meters, and thenfinally comes to a rest."
1312,Page 28,"""Damn!""Such incredible power.A servant of god, a demon's power.A normal person like me has no chance against her.Power is gushing out of her body, and it emits a pale light. I cannot evenapproach her."
1313,Page 29 (Spinning Flauros),"""Huh? What is this?""Suddenly a blinding light emits from my pocket.It is that four-sided object, the Flauros.Light shoots out in a straight line from each of the points of its triangles,and it eventually rises up into the air."
1314,Page 30,"Just as I thought that the great light and sound it was wrapped in meant thatits power was greater than Alessa's, the power of the Flauros condensed,became a beam of light, and pierced Alessa's body."
1315,Page 31 (Nightmare amusement park floor) (Alessa appears),"Just as I was just before, Alessa was blown backwards by that power, whichshe could not overcome."
1316,Page 32,"""Where's Cheryl? Give me back my daughter.""I was on the verge of passing out, and I thought of Cheryl.All I can do is calmly look at the unbelievable sight before me as it unfoldsbefore my eyes."
1317,Page 33,"What just happened? Is Cheryl ok?However, she does not answer me.Instead, a hoarse voice passes into my thoughts, and it is accompanied bythe sound of footsteps."
1318,Page 34 (Dahlia appears),"""We meet at last, Alessa.""""......!""""Dahlia  Gillespie......"""
1319,Page 35,Unable to move from my prone position I thought about who's voice that was.And then using all my strength I stand.After confirming that it was Dahlia in front of me I spoke in a voice thatwas nearly a yell.
1320,Page 36,"""Where's Cheryl? Where is she?"""
1321,Page 37,"Dahlia does not hear me yelling.She does not look back, and looks at Alessa with a creepy smile."
1322,Page 38,"""Alessa. This is the end of your little game.""""Mama...""Mother...? I am confused.""Huh? Could she be...?"""
1323,Page 39,"""You've been a ghastly little pest, haven't you? Alessa?I was careless. Thinking you couldn't escape from our spell."
1324,Page 40,"But Mommy didn't know how much you'd grown.That's why I couldn't catch you all by myself.But what a pity, yes?Now you're half indebted to this man for his help."""
1325,Page 41,"""Hey! What are you talking about?""My voice just echoes emptily in the darkness."
1326,Go to 15-4,"_______________________________________________________________________________第十五章　「遊園地」                            　    　　                 15-4ダリアとアレッサ                                     (Nightmare amusement park)Chapter 15   ""Amusement Park""Dahlia and Alessa"
1327,Page 1 (Nightmare amusement park floor) (Alessa appears) (Dahlia appears),"""Alessa. My dear little girl...There is one thing left I need you to do for me.""""No. Get away from me.""""Bad girl. Everything is ready. Let's go home now, uh-hmm?"""
1328,Page 2 (Alessa and Dahlia disappear),Wait...What about Cheryl...Just where is she...give me back my daughter...my daughter...Cheryl...
1329,Go to 15-5,"_______________________________________________________________________________第十五章　「遊園地」                            　    　　                 15-5………。                                             (Nightmare amusement park)Chapter 15   ""Amusement Park""........."
1330,Page 1 (Black),......................................................
1331,Go to 16-6 if you chose B in 13-2,"_______________________________________________________________________________第十五章　「自宅」                            　    　　                   15-6書き上がった原稿                                                        (Black)Chapter 15   ""Home""The completed manuscript"
1332,Page 1 (Harry's desk),"""All right...""That is as far as my memory goes.Any thing beyond that is vague, and to give an account of it I would haveto make things up."
1333,Page 2,"However, I do not wish to include any fabrications in this story, that is mytrue intention.In this case truth is stranger than fiction.But if I said that it was the truth then I doubt anyone would believe me."
1334,Page 3,"I carefully read over the manuscript again.I could never even think about forgetting the detestable events ofseven years ago.Even now, my body quivers."
1335,Page 4,"And because of this when the request came in, at first I considered refusingbecause the contents were too similar to the world view.However, the person in charge pushed me into it."
1336,Page 5,"Perhaps it is an overstatement to call this a diary.It is not exactly my memoirs either.I just described those events within the range of my personal tastes.There was no commercial greediness, and I never had the ambition of havingthis story known by everyone."
1337,Page 6,"It is merely a world of self-satisfaction.第十五章　「自宅」「口を尖らせたシェリル」Chapter 15   ""Home""Cheryl pouts"
1338,Page 7,"After looking over the manuscript again I let out a long sign, and neatlypushed the stack of papers together and placed them in the envelopeI had prepared."
1339,Page 8,I licked the seal of the envelope and then tightly sealed it.The act of properly sealing the envelope with such feeling seemed like acertain kind of ceremony.
1340,Page 9 (Cheryl in Harry's house),"""Daddy""I turn around and Cheryl is standing there pouting.""Ah, sorry. I have just finished. Sorry to have kept you waiting.""Cheryl smiled, returned to her room downstairs, and pulled several of herbest outfits out of a wardrobe."
1341,Page 10 (Black),"Tomorrow is the deadline.If I mail it tonight by express mail it should arrive at the proofreaderin time.""I'll just be a little longer.""I said that to her in front of her room and then placed my hand on thefront door."
1342,Page 11 (Telephone on desk),Ziriririri... (Onomatopoeia for ringing phone)The phone rings.Who is it?
1343,Go to 15-7,"_______________________________________________________________________________第十五章　「自宅」                            　    　　                   15-7けたたましく鳴る電話                                                    (Black)Chapter 15   ""Home""The noisy ringing phone"
1344,Page 1 (Telephone on desk),"I stopped, and listened to the ringing of the phone.A ) ""It might be urgent, but Cheryl will probably get it."""
1345,Go to 15-8 (Ending D-1),"B ) ""It's probably the publishing company, they are so impatient."""
1346,Go to 15-9 (Ending D-2),"_______________________________________________________________________________第十五章　「自宅」                            　    　　                   15-8シェリルに任せる                                                        (Black)Chapter 15   ""Home""Leave it to Cheryl"
1347,Page 1 (Telephone on desk),"It might be urgent, but Cheryl will probably get it.Or they can just call back later.The mailbox is not far from here.I mumbled to myself, opened the door, and left my house.第十五章　「自宅」「電話を取るシェリル」Chapter 15   ""Home""Cheryl answers the phone"
1348,Page 2,"""Daddy! Are you here?""Cheryl called out in a loud voice right after Harry left the house.There is no answer.There is no helping it.With no other choice Cheryl rushed to the phone and picked up the receiver."
1349,Page 3,"""Hello.""""Oh, Cheryl. It's daddy.""""Daddy? Where are you now?""""I am in front of the mailbox.I am meeting an acquaintance of mine.I will be done soon."""
1350,Page 4,"""Hurry up and come home.Or else it will get late.""""Yeah...sorry.I will hurry home.By the way Cheryl, there is a place I want to stop before we go to theamusement park. Is that ok?""""Where?"""
1351,Page 5,"""Silent Hill.""The End D-1You will now receive the following Digital Trading Card:24. Study_______________________________________________________________________________第十五章　「自宅」                            　    　　                   15-9電話まで引き返す                                                        (Black)Chapter 15   ""Home""Harry goes back to the phone"
1352,Page 1 (Telephone on desk),I reluctantly turn and run to the phone.At this hour the only person I could imagine calling would be someone fromthe publishing company.
1353,Page 2,"""Hello...""..........................."
1354,Page 3,The telephone is silent...Perhaps it's a prank call?
1355,Page 4,"""Hello?If you have nothing to say then I am going to hang up.I have no interest in dealing with a prank call.""At the moment I was about to hang up the receiver the unseen caller finallyspoke."
1356,Page 5,(......Hello......)My hand holding the receiver trembles.That voice is...!
1357,Page 6,"That voice is......There is no doubt.The receiver fell to the floor, but I did not notice."
1358,Page 7 (Black),Seven years ago...The town clouded with fog...The school stained with the smell of mildew...The empty teacher's room...On the table...
1359,Page 8,"The fragments of my memory come together in my head like a jigsaw puzzle.There is no doubt, that..."
1360,Page 9 (Cheryl in chair),"I rush up the stairs.""Cheryl...!""Cheryl had completed getting ready, and was sitting quietly on a three-leggedwooden chair."
1361,Page 10,"""What's wrong? Daddy?""""I'm sorry...but something urgent has come up.It doesn't look like we will be able to go to the amusement park.I will have to leave you here alone, but...will you be ok?"""
1362,Page 11,"The expression that I expected appeared on Cheryl's face.""Hey, you promised!""""I'm sorry...I have to go right away..."""
1363,Page 12,Suddenly a different memory rose up in my mind.
1364,Page 13 (Black),The town with a lake...The pier in the darkness...The lighthouse at its end...
1365,Page 14,The man who saved me...And then...Definitely next to...
1366,Page 15 (Cheryl in chair),"""Cheryl, I've changed my mind, why don't you come with me?""""Where to?"""
1367,Page 16,"This time I spoke with confidence.""Silent Hill...Yes, the lighthouse in Silent Hill.We're going to help someone that is in trouble there."""
1368,Page 17 (Black),"I took my amazed daughter's hand in mine and we bolted out of the house.The End D-2You will now receive the following Digital Trading Card:12. Twin Feeler_______________________________________________________________________________第十六章　「病院」                            　    　　                   16-1リサの囁き                                             (Lisa leaning on a wall)Chapter 16   ""Hospital""Lisa's whispering"
1369,Page 1 (Lisa leaning on a wall),Lisa?What happened?Where's Alessa and Dahlia?
1370,Page 2,"Harry, listen.Something you said before has been bothering me.I just can't get it out of my head."
1371,Page 3,What is it Lisa?
1372,Page 4,"So I went to look in the basement. Even though I was scared as hell.Like you said, there were these creepy rooms."
1373,Page 5,"But nothing really unusual down there.But while I was down there, I got this weird feeling.Like I'd been there before."
