id,name,thread
0,Page 1 (Long shot of jeep),"It's been a while since I have taken a vacation.I am driving my jeep.Heading towards the quiet resort town of Silent Hill, the sound of the enginereverberates in the darkness.Due to some slight car trouble earlier, it has become this late."
1,Page 2 (Harry in jeep),I am Harry Mason.I am a run of the mill writer.
2,Page 3 (Cheryl in jeep),"Her eyes closed, Cheryl sleeps peacefully in the passenger seat.Cheryl is my daughter.She is cheerful and lively, and the occasional carefree smiles she shows memake me feel happy."
3,Page 4,"I don't have very many relationships with people because of what I do for aliving, so Cheryl's existence has become irreplaceable to me.Cheryl was very much looking forward to this trip."
4,Page 5 (Harry in jeep),"Although paved, this is still very much a mountain road.At this hour there is little reason for any other drivers to be about.I push in the accelerator.There is no light off in the darkness.I can depend only on my headlights."
5,Page 6 (Cybil on motorcycle),Light reflects off the rear view mirror.It's a motorcycle.There is a motorcycle headed toward the same destination as we are at terrificspeed at this late hour.With a roar the motorcycle effortlessly passes by the side of my jeep.
6,Page 7,The seal of the police...Perhaps there has been an accident or something?But I don't recall hearing about an accident or anything on the radio.
7,Page 8 (Cheryl in jeep),Cheryl is sleeping.A child should not be awake at this hour.I wonder if she is dreaming about something?Tomorrow I have planned to take her to the amusement park.Maybe she is dreaming about riding the merry-go-round?
8,Page 9 (Harry in jeep),I glance over at Cheryl's sleeping face and then return my eyes forward.The lighted area of the road almost appears to be belched out from thedarkness as it moves toward me.Huh? Something enters my field of view.
9,Page 10 (Fallen motorcycle),"It's the motorcycle from just before.It is lying on its side on the shoulder of the road.No doubt about it, it's the same motorcycle that just passed me.There is no sign of the driver. It looks like the driver smashed into thesurface of the rocks by the side of the road while trying to avoid some kindof obstacle, and thus that part of the motorcycle has been destroyed."
10,Page 11 (Road),"I carefully check the way in which my vehicle is headed.However, I don't see anything that could be an obstacle to my advance in thearea illuminated by the headlights. A strange atmosphere creeps in around me.The radio reception begins to become erratic."
11,Page 12 (Harry in jeep),"Perhaps I should turn back? But my foot persistently pushes down theaccelerator with no intention of letting off.""You can no longer turn back now...""Something murmurs within me.""Please increase your speed some more...""Someone murmurs within me."
12,Page 13 (Cheryl in jeep),"Cheryl's eyes are closed.She is dreaming.I know that I should be awake.But what is this uneasy feeling?I feel as if my body is not totally my own.It's like someone, some strange being that is not me, is controllingme...like I am floating."
13,Page 14,"My eyelids are heavy. As the steering wheel leaves my hand it creates theillusion of setting the course on its own.Freezing cold...Uneasiness...Almost like being ready to fall asleep, I am just barely conscious, and now atmy limit to maintain even that."
14,Page 15 (Harry with his hand off the steering wheel),"""Ah......"""
15,Page 16 (Girl-like figure in front of the jeep),"When I saw the human figure on the road I cut the wheel hard, and then therewas nowhere else for my jeep and I to go but down into the darkness below thecliff."
16,Go to 1-1,"_______________________________________________________________________________第一章　　「到着」                                                          1-1車で目覚めるハリー                                      (Harry in wrecked jeep)Chapter 1   ""Arrival""Harry wakes up in his jeep"
17,Page 1 (Black),"The silence pierces my ears.As the wind blew, it was accompanied by piercing cold.Where am I? I can feel light faintly passing through myeyelids."
18,Page 2,"I don't seem to be hurt.That much is clear to me because I don't feel any pain in my body.No, perhaps I've suffered an injury that doesn't cause any pain?"
19,Page 3,"I...slowly try opening my heavy eyelids.第一章　　「到着」「季節外れの雪」Chapter 1   ""Arrival""Out of season snow"
20,Page 4 (Harry in wrecked jeep),"Out of season snow is pouring into the town.Other than the sound of droplets of ice hitting the ground, there is nothingelse to be heard.""Silent Hill""That is what is assuredly written on the sign by the side of the road. Withoutrealizing it, Cheryl and I have reached our destination."
21,Page 5,"All my memories up to that point are gone.The wind is blowing in...When I take a look next to me, I am shocked."
22,Page 6 (Empty seat of jeep),"The passenger door has been left open.Cheryl is nowhere to be seen.第一章　　「到着」「ゴーストタウン」Chapter 1   ""Arrival""Ghost Town"
23,Page 7,"""Silent Hill.""This town, which should just be a resort area, appears to have become justlike a ghost town for some reason, or maybe it was waiting for us toarrive, or perhaps the town just nestled up to us..."
24,Page 8,"So now I am alone.Cheryl is not here.While I was sleeping, no, while I was knocked out Cheryl opened thepassenger door and stepped out ""alone"" into this tourist spot that isruled by an unsettling silence."
25,Page 9,And then she left me to head somewhere...
26,Page 10 (Harry in front of wrecked jeep),"I tightly close my jacket around my neck and set off on foot insearch of Cheryl.I wonder what in the world happened here?Nothing makes any sense.The silence, the out of season snow...And strangest of all, the entire town is wrapped in a thick fog."
27,Go to 1-2,"_______________________________________________________________________________第一章　　「無人の街」                                                      1-2人影を捜し求めて                               (Harry in front of wrecked jeep)Chapter 1   ""The Deserted Town""In search of anyone"
28,Page 1 (Harry in front of wrecked jeep),"""What is going on...""A) Cheryl's destination is..."
29,Go to 1-3,B) Is there no one in the town...
30,Go to 1-4,"_______________________________________________________________________________第一章　　「シェリルの行方」                                                1-3シェリル捜索に乗り出す                               (Street corner, heavy fog)Chapter 1   ""Cheryl's Whereabouts""Beginning the search for Cheryl"
31,"Page 1 (Street corner, heavy fog)",I begin to run.Only the sounds of my footsteps echo in the surroundings.Just where in the world has Cheryl gone?Did someone lead her away?Various concerns run through my mind.
32,Page 2 (Cheryl appears),"(Ta ta ta ta...) (Onomatopoeia for footsteps)I suddenly get the feeling that I heard footsteps other than my own, so I stopmoving right away to check it out."
33,Page 3,"Through the thick fog I can see a figure that is about the size of a child.""Cheryl?""Without a thought I cry out.The figure doesn't move at all."
34,Page 4 (Cheryl disappears),"At the moment I begin to move slowly towards the figure it starts to run.I fiercely chase after the figure.That's definitely Cheryl.Even though it is faint, I would not mistake someone else for Cheryl."
35,Page 5,"However, no matter how much I run I cannot catch up.Instead the figure is gradually getting farther away from me.The figure puts on speed as if it is gliding through the air."
36,"Page 6 (Middle of street, heavy fog)","The figure appears to be absorbed by the fog as it begins to disappear.In order not to lose it, I run with all my strength while keeping my visioncentered on the figure."
37,Page 7,I then notice that I have come to an alley surrounded by buildings.
38,Page 8 (Dark alley),"I don't know how, but it is like a cover was placed over the sky, which hadprovided light until now, and the area has become engulfed in darkness."
39,Go to 1-5,"_______________________________________________________________________________第一章　　「住人の存在」                                                    1-4他に誰かいないものか                                 (Street corner, heavy fog)Chapter 1   ""The Presence of Townspeople""Is there no one else here?"
40,"Page 1 (Street corner, heavy fog)","I thought, I must find out if there is anyone other than myself here.This is definitely Silent Hill.I recognize the signboard on that store.A long time ago, when I was young I visited here once."
41,Page 2,"All the doors on the shops and houses are tightly shut.No...Among them there is one shop with its door open, but there is no sign ofanyone inside."
42,Page 3,It feels like just the people here suddenly vanished.
43,Go to 1-3,"_______________________________________________________________________________第一章　　「複数の足音」                                                    1-5不気味な裏路地                                                     (Dark alley)""Multiple Footsteps""The eerie alley"
44,Page 1 (Dark alley),From the darkness I can hear multiple footsteps coming this way...A ) I don't know who it is. I will take a look.
45,Go to 1-6,B ) I am going to get out of here...I don't have anything with me that can be used as a weapon.
46,Go to 1-7,"_______________________________________________________________________________第一章　　「耳を澄まして」                                                  1-6様子をうかがうハリー                                               (Dark alley)Chapter 1   ""Listen Carefully""Harry looks around"
47,Page 1 (Dark alley),"I stood ready.""What the... What are they...""With beast-like rage, they have closed in to right where I am."
48,"Page 2 (Mumblers appear, then fade)","""Ah...""And then my vitality is sucked away by these strangely shaped monsters until Ifinally lose consciousness............"
49,Go to 2-1,"_______________________________________________________________________________第一章　　「闇への逃亡」                                                    1-7逃げ出すハリー                                                     (Dark alley)Chapter 1   ""Escape into the Darkness""Harry runs away"
50,Page 1 (Dark alley),I've got to get away.But I can't go back the way I came...because that eerie presenceis back there...
51,Page 2,So I move further in.I can only move gradually through the narrowing pitch-black alley byfeeling around with my hands.
52,Page 3,"But I only end up reaching a dead end.Metal fences surround the area, and they are so high that I don't think thatI can climb over them."
53,Page 4,They are coming from behind...
54,Page 5,"I stood ready.""What the... What are they...""With beast-like rage, they have closed in to right where I am."
55,"Page 6 (Creatures appear, then fade)","""Ah...""And then my vitality is sucked away by these strangely shaped monsters until Ifinally lose consciousness............"
56,Go to 2-1,"_______________________________________________________________________________第二章　　「運命の出会い」                                                  2-1シビル・ベネットと出会う                                    (Close up of radio)Chapter 2   ""The Fated Meeting""Harry meets Cybil Bennet"
57,Page 1 (Black),Cybil Bennet.She is a full time police officer working in the neighboring townof Brahms.There was no one else in the cafe other than her and Harry.She took a seat at the counter and waited for Harry to awaken.Movie: Harry wakes up in Cafe 5 to 2
58,Page 2,"I suddenly awoke.Where is this place? Why am I here? Was I brought here by someone? There isno boundary between dream and reality, just confusion."
59,Page 3,"As I lay on the bench seat in the cafe my eyes slowly begin to focus.The woman sitting at the counter stands and folds her arms. She walks overand looks down at me.第二章　　「カフェ」「シビル・ベネット」Chapter 2   ""Cafe""Cybil Bennet"
60,Page 4 (Cybil standing in the center of the cafe),"She is wearing a police uniform.The woman smiles a little bit, as she appears to be relieved that I haveregained consciousness."
61,Page 5,"""It looks like you have come around.""""Who are you?""I try talking to the unfamiliar woman."
62,Page 6,"""I'm Cybil.Cybil Bennet.I'm here because all communication with this town suddenly went dead and so Icame to investigate."""
63,Page 7,"""I'm...Harry Mason. I brought my daughter to this town for some sightseeing,but on the way there was an accident and I lost consciousness...Oh, yeah, Cybil...You haven't seen a little girl in this town have you?"""
64,Page 8 (Cybil's picture changes),"""A little girl...No, I haven't seen her...""""When I came to after the accident my daughter was nowhere to be seen.The passenger door was open and she was gone."
65,Page 9,"Cheryl...uh, sorry, my daughter's name is Cheryl...She is a timid person, so it is hard to imagine that she headed out into thisweird town alone.Plus I was there in the driver's seat...And since she gave me no warning it just doesn't make sense."
66,Page 10,"Are you familiar with this area?There is no sign of anyone, and what is going on with the snow at this timeof year...Just what in the world has happened in this town?""I said all of this while breathing deeply."
67,Page 11 (Cybil's picture changes),"""I'm afraid I don't know either.I still haven't seen anyone other than you.It's like the town is as silent as a graveyard, left without even the meansto contact any neighboring towns.""""I see."""
68,Page 12,"""You also had an accident, right?I thought it was a good idea to head to the police station in this town aloneon my motorcycle, but...I guess I was going a little too fast."
69,Page 13,A girl suddenly jumped out into the road...I am pretty sure it was a girl...Ialmost hit her.I cut the handlebars hard in order to avoid her...After that I can barely remember anything......
70,Page 14,"When I came to I was lying in the street in front of this cafe.So naturally I came in here to get out of the snow.And then I found you sleeping there..."""
71,Page 15,"""I...was having some kind of a terrible dream.As for if I made it here on my own, I don't remember at all...Just what in the world has happened in this town...What is going on with everything?"""
72,Page 16,"""Well, the situation is definitely strange.I will head back to Brahms for reinforcements, and then return here.How about you?""Cybil stood and fixed her collar with resolute fortitude."
73,Page 17,"""I've got to look for Cheryl...There is no way I can just leave her here alone."""
74,Page 18 (Gun in Cybil's hand),"""I see. Well, I'll give you this then.You never know what might happen under these circumstances.If you feel threatened then pull the trigger without hesitating."""
75,Go to 2-2,"_______________________________________________________________________________第二章　　「拳銃」　　　　                                                  2-2拳銃を差し出されて                                        (Gun in Cybil's hand)Chapter 2   ""Handgun""Cybil holds out the handgun"
76,Page 1 (Gun in Cybil's hand),I take the gun into my hand.A ) Thanks...I hope I don't have to use it...
77,Go to 2-3,"B ) Thank you, but...I'm no good with guns."
78,Go to 2-4,"_______________________________________________________________________________第二章　　「拳銃の重み」　　                                                2-3シビルより銃を受け取る                                    (Gun in Cybil's hand)Chapter 2   ""The Weight of the Handgun""Harry receives the gun from Cybil"
79,Page 1 (Cybil standing in the center of the cafe),Having never handled a handgun before I am surprised by how heavy it is.
80,Page 2,"""But you...will you be alright?""""I'm not like the average girls around here.I have undergone proper training."""
81,Page 3 (Close up of Cybil in front of cafe door),"Cybil placed her hand on the exit door, but then she turns and faces meagain."
82,Page 4,"""Harry. Don't go shooting me by mistake or anything.I haven't had any training on how to stop bullets.""She smiled after saying this and then disappeared into the thick fog."
83,Page 5 (Empty cafe),"(No text, page automatically is dismissed)"
84,Go to 2-5,"_______________________________________________________________________________第二章　　「銃器は苦手」　　                                                2-4使い方を教えるシビル                                        (Close up of radio)Chapter 2   ""No Good with Guns""Cybil shows Harry how to use the gun"
85,Page 1 (Cybil standing in the center of the cafe),"""Thank you, but...I'm no good with guns.I haven't even touched one.I can't handle it."""
86,Page 2 (Gun in Cybil's hand),"Amazed, Cybil takes a deep breath.""It's simple.I'll show you how to use it.See, first hold it in your right hand, then place your forefinger on thetrigger.""I reluctantly followed her instructions."
87,Page 3,"""Like this?""""Yes. Now place your left hand on your right hand so that it doesn't move.Then all you have to do is slide this, fix your aim, and pull the trigger.""""Like this?"""
88,Page 4 (Black),Bang!The bullet grazes Cybil's cheek and penetrates the wall of the cafe. One ofpictures on the wall falls.
89,Page 5 (Cybil standing in the center of the cafe),"""He...Hey!You need to watch it!!""""I'm sorry, I was just doing what you said and it just...""""No it's not ""and it just...""Just a few centimeters over and you would have been a murderer!"""
90,Page 6,"I lost even more self confidence.""Well, it's all right.Please use it carefully.Well then...I'm going.""The sound of the door closing reverberated woefully inside the cafe."
91,Page 7 (Close up of Cybil in front of cafe door),"(No text, page automatically is dismissed)"
92,Go to 2-5,"_______________________________________________________________________________第二章　　「再び一人に」　　                                                2-5カフェを後にするシビル                                      (Close up of radio)Chapter 2   ""Alone Again""Cybil leaves the cafe"
93,Page 1 (Harry with the gun in the cafe),"After being left alone in the cafe I gazed at the handgun Cybil gave me for alittle while.And then I thought about Cheryl, who had disappeared in this town."
94,Page 2,"The figure I saw in the fog...That was definitely Cheryl.But she didn't answer my calls, and she was quite possibly moving away fromme?"
95,Page 3,"I don't understand...I am getting a bit mixed up.Still, the one thing I know for sure is that Cheryl has vanished in this town."
96,Page 4,"All I can do is look for her.I may not have any knowledge of the surroundings or any clues, but I won'tfind Cheryl if I stay here.I stood up energetically and placed my hand on the cafe door."
97,Page 5,(JiJiJi...JiJi...JiJiJi.........) (Onomatopoeia for radio static)
98,Page 6,Something is making noise.
99,Page 7,(JiJiJiJi...JiJiJiJi...JiJi...) (Onomatopoeia for radio static)
100,Page 8,?
101,Go to 2-6,"_______________________________________________________________________________第二章　　「音の源」　　　　　　　　　　　　　　　　　　　　　　　　　　　　2-6どこかで音が鳴っている…                                    (Close up of radio)Chapter 2   ""The Source of the Noise""Noise is coming from somewhere..."
102,Page 1 (Harry with the gun in the cafe),What is that noise?A ) It's somewhere inside the cafe...
103,Go to 2-7,B ) It's somewhere outside the cafe...
104,Go to 2-8,"_______________________________________________________________________________第二章　　「カフェの中に？」　　　　　　　　　　　　　　　　　　　　　　　　2-7ラジオを拾い上げるハリー                                    (Close up of radio)Chapter 2   ""Inside the Cafe?""Harry picks up the radio"
105,Page 1 (Harry with the gun in the cafe),"I look around the cafe.I walk in the direction the noise is coming from.And then I pick up the source of the noise.""Radio?"""
106,Page 2 (Close up of radio),"(No text, page automatically is dismissed)"
107,Page 3 (Air Screamer breaking cafe window),At that moment the window glass shattered with a thunder and a giant birdlikecreature flew into the cafe.
108,"Page 3 (Air Screamer, animated)","No, it is not a bird.It is a creature with reddish-brown skin that looks as if it has been burned."
109,Page 4,In its belligerent pale green eyes it is clear that my life is in danger.
110,Go to 2-9,"_______________________________________________________________________________第二章　　「カフェの外に？」　　　　　　　　　　　　　　　　　　　　　　　　2-8窓越しのラジオ                                              (Close up of radio)Chapter 2   ""Outside the Cafe?""The radio beyond the window"
111,Page 1 (Street outside of the cafe),Outside?I open the door and hurry out into the street. The snow still continues tofall.I breathe in the cold outside air and it feels like waking up.
112,Page 2,The noise I just heard until now had stopped.Is the wind drowning it out?My question was soon answered.
113,Page 3,"Through the glass I can see that a radio has been placed on top of a tableinside the cafe.""Is it that...""I immediately went back inside the cafe."
114,Page 4 (Close up of radio),"The noise has stopped. Thinking that it may come in handy for something,I slide the portable radio into my pocket and once again walk toward thecafe's exit."
115,Go to 2-17,"_______________________________________________________________________________第二章　　「空からの使者」　　　　　　　　　　　　　　　　　　　　　　　　　2-9突然の襲撃にハリーは…                      (Air Screamer breaking cafe window)Chapter 2   ""Messenger from the Sky""In this sudden assault, Harry..."
116,"Page 1 (Air Screamer, animated)",I...A ) hide underneath a table.
117,Go to 2-10,B ) ready the handgun in my inexperienced hands.
118,Go to 2-11,C ) run outside of the cafe.
119,Go to 2-12,"_______________________________________________________________________________第二章　　「テーブルの下へ」　　　　　　　　　　　　　　　　　　　　　　　 2-10咄嗟に隠れるハリー                          (Air Screamer breaking cafe window)Chapter 2   ""To Under a Table""Harry instantly hides"
120,Page 1 (Animated flying creature),"I immediately hid underneath a nearby table.However, it was smarter than I thought."
121,Page 2,"At a glance its legs appeared thin, but it spreads them wide and uses itslong nails as a tool to lift the table up and then lets out a loud laugh."
122,Page 3,I don't have a choice. I have to try and fight. But if I randomly fireblindly then I will only waste bullets.
123,Page 4,"That's it. I must set my aim. Its body. When it spreads its wings, at thatmoment when its body is undefended, I will..."
124,Page 5,"It swings its large arm-like wing down at me and using that ""weapon"" it justmisses my neck."
125,Page 6,"This is my chance.The target is its body...Mumbling, I tell myself that.However...I can't fix my aim very well.My hands are shaking.(Gun shot sound, then Air Screamer falls)"
126,Page 7 (Dead Air Screamer on cafe floor),When that single bullet hit it...It finally lost its life force and fell to the floor like a rag.
127,Go to 2-16,"_______________________________________________________________________________第二章　　「発砲」　　　　　　　　　　　　　　　　　　　　　　　　　　　　 2-11慣れない手で拳銃を構える                    (Air Screamer breaking cafe window)Chapter 2   ""Fire""Harry readies the handgun in his inexperienced hands"
128,"Page 1 (Air Screamer, animated)","""Damn!""I firmly held the handgun that I just received, quickly pointed it at thecreature, and pulled the trigger."
129,Page 2,"I am not used to using guns, so some of my shots hit the ceiling."
130,Go to 2-13,"_______________________________________________________________________________第二章　　「カフェの外へ」　　　　　　　　　　　　　　　　　　　　　　　　 2-12狭い室内では戦えない                        (Air Screamer breaking cafe window)Chapter 2   ""To Outside the Cafe""Harry cannot fight in the tight space indoors"
131,"Page 1 (Air Screamer, animated)",I've got to get out of here. Outside.I can't move about so well in this tight indoor area.However...
132,Page 2,"Almost as if reading my mind, it moves to the only door in or out of the cafe,blocking my route.I can't escape."
133,Page 3,"Then right as I think that maybe it has pulled one of its wings far back,it swings it down at me just missing my neck.""Ah!"""
134,Page 4,"I just barely avoided death, but in the process I ended up falling backwards."
135,Page 5,"However, I didn't let go of the gun."
136,Page 6,The target is the wing...
137,Page 7,"If I can destroy its wing it won't be able to move.Then I can finish it at my leisure.(Gun shot sound, then Air Screamer falls)"
138,Page 8 (Dead Air Screamer on cafe floor),"My one shot hits the wing, blasting a hole in it. The creature loses altitudeas it falls to the floor."
