id,name,thread803,Go to 10-9,"_______________________________________________________________________________第十章　　「タウンセンター」　                　  　　　　                 10-9一瞬の迷い                                          (Sandy area in Town Center)Chapter 10   ""Town Center""A moment of hesitation"
804,"Page 1 (Twin Feeler, animated)",However...
805,Go to 10-10,"_______________________________________________________________________________第十章　　「タウンセンター」　                　  　　　　                10-10揺れる戦略                                          (Sandy area in Town Center)Chapter 10   ""Town Center""A shaky strategy"
806,"Page 1 (Twin Feeler, animated)",I...A ) move onto the steel plate.
807,Go to 10-11,B ) stay where I am...
808,Go to 10-12,"_______________________________________________________________________________第十章　　「タウンセンター」　                　  　　　　                10-11鉄板の上へ移動するハリー                            (Sandy area in Town Center)Chapter 10   ""Town Center""Harry moves onto the steel plate"
809,"Page 1 (Twin Feeler, animated)",After moving onto the steel plate I discovered one problem with doing so.I can no longer tell where it is coming from.
810,Page 2,I can only go with my intuition.Just where it is going to appear from...
811,Go to 10-13,"_______________________________________________________________________________第十章　　「タウンセンター」　                　  　　　　                10-12そのままの位置で戦う                                (Sandy area in Town Center)Chapter 10   ""Town Center""Harry fights where he was standing"
812,"Page 1 (Twin Feeler, animated)","I will not move from this position.The steel plate looks like it would be safe; however, I would not be able tosense its movements below me if I moved on top of it.I judged that staying in this position is best for attacking."
813,Page 2,Finally...It is about to rise above the ground again.Just where is it going to appear from...
814,Go to 10-17,"_______________________________________________________________________________第十章　　「タウンセンター」　                　  　　　　                10-13見えざる敵の気配                                    (Sandy area in Town Center)Chapter 10   ""Town Center""A sign of the unseen enemy"
815,"Page 1 (Twin Feeler, animated)",I gamble.A ) Behind
816,Go to 10-14,B ) Front
817,Go to 10-15,C ) Side
818,Go to 10-16,"_______________________________________________________________________________第十章　　「タウンセンター」　                　  　　　　                10-14鉄板上…背後に気配                                  (Sandy area in Town Center)Chapter 10   ""Town Center""On the steel plate...I sense it from behind"
819,"Page 1 (Twin Feeler, animated)",I listened carefully.I wagered that it is coming from behind.
820,Page 2,I spin around and fire the rifle.It had just appeared there and my first shot went right through its head.
821,Page 3,"It exploded like a piece of fruit exploding, and liquid with a revolting colorand horrible smell began to flow around it.I pursue it as it begins to try and escape back into the ground, firingthe rifle on this deserted floor of the Town Center."
822,Go to 10-20,"_______________________________________________________________________________第十章　　「タウンセンター」　                　  　　　　                10-15鉄板上…正面に気配                                  (Sandy area in Town Center)Chapter 10   ""Town Center""On the steel plate...I sense it in front of me"
823,Page 1 Twin Feeler (animated),"The front...I hold the rifle low, and aim at the area where I think it will come out withmy finger poised on the trigger."
824,Page 2,I pulled the trigger at the same time I heard it come up out of the ground.However...The bullet just flies through the air.
825,Page 3,"Once I realized this it was already too late.Its giant body was towering over me from behind, with its tusks alreadybrimming with poison, and then that poisonous liquid fell upon my raised arm."
826,Page 4,"Ow...!I immediately turned, aimed at its abdomen, and fired.Luckily the poison liquid only burned my jacket, and did not reach my skin."
827,Page 5,"I pulled the trigger over and over until I ran out of bullets.As its screams echoed, the only that that kept me goingas I was about to pass out was......Cheryl's smiling face in my memories."
828,Go to 10-20,"_______________________________________________________________________________第十章　　「タウンセンター」　                　  　　　　                10-16鉄板上…側面に気配                                  (Sandy area in Town Center)Chapter 10   ""Town Center""On the steel plate...I sense it at my side"
829,"Page 1 (Twin Feeler, animated)","From the side...I ready the rifle with my right hand.I can quickly attack to the left, but it will take a little time to attackto the right."
830,Page 2,So I wager on the left.I calm my breathing so that I will be able to fire as soon as I see it.
831,Page 3,"However, it...It went against my prediction and appeared behind me....I won't make it in time."
832,Page 4,As soon as I turned around a shower of poisonous liquid sprayed from itsmouth and fell all over my face.
833,Page 5,"""Ugh...!""I cannot even speak.I wipe my face with my hands.This time I felt the pain of burning on the palms of my hands."
834,Page 6,I aimed at it and pulled the trigger over and over.The sounds of an explosion and then a scream repeat over and over. Then agreat tremor shakes the earth and it escapes underground.
835,Page 7,Without resting I stand.Because my intuition tells me that Cheryl is in danger.
836,Go to 10-20,"_______________________________________________________________________________第十章　　「タウンセンター」　                　  　　　　                10-17推測                                                (Sandy area in Town Center)Chapter 10   ""Town Center""Guessing"
837,"Page 1 (Twin Feeler, animated)",(No text)A ) Behind
838,Go to 10-18,B ) Front
839,Go to 10-19,"_______________________________________________________________________________第十章　　「タウンセンター」　                　  　　　　                10-18砂地…背後に気配                                    (Sandy area in Town Center)Chapter 10   ""Town Center""Sandy soil...I sense it behind me"
840,"Page 1 (Twin Feeler, animated)",I listened carefully.I wagered that it is coming from behind.
841,Page 2,I spin around and fire the rifle.It had just appeared there and my first shot went right through its head.
842,Page 3,"It exploded like a piece of fruit exploding, and liquid with a revolting colorand horrible smell began to flow around it.I pursue it as it begins to try and escape back into the ground, firingthe rifle on this deserted floor of the Town Center."
843,Go to 10-20,"_______________________________________________________________________________第十章　　「タウンセンター」　                　  　　　　                10-19砂地…正面に気配                                    (Sandy area in Town Center)Chapter 10   ""Town Center""Sandy soil...I sense it in front of me"
844,Page 1 Twin Feeler (animated),"The front...I hold the rifle low, and aim at the area where I think it will come out withmy finger poised on the trigger."
845,Page 2,I pulled the trigger at the same time I heard it come up out of the ground.However...The bullet just flies through the air.
846,Page 3,"Once I realized this it was already too late.Its giant body was towering over me from behind, with its tusks alreadybrimming with poison, and then that poisonous liquid fell upon my raised arm."
847,Page 4,"Ow...!I immediately turned, aimed at its abdomen, and fired.Luckily the poison liquid only burned my jacket, and did not reach my skin."
848,Page 5,"I pulled the trigger over and over until I ran out of bullets.As its screams echoed, the only that that kept me goingas I was about to pass out was......Cheryl's smiling face in my memories."
849,Go to 10-20,"_______________________________________________________________________________第十章　　「タウンセンター」　                　  　　　　                10-20タウンセンターを後に                                     (Gigastore storefront)Chapter 10   ""Town Center""Leaving the Town Center"
850,Page 1 (Black),I leave the Town Center.
851,Go to 11-1,"_______________________________________________________________________________第十章　　「骨董屋」        　                　  　　　　                10-21揺れる視界                                                       (Antique shop)Chapter 10   ""Antique Shop""Swaying field of vision"
852,"Page 1 (Antique shop, flickering)",..................
853,Page 2,My field of vision is swaying...
854,Page 3,I pressed my back to a wall and steadily slid down until I reached thecold floor.The shadows of several of the items in the room expand and contract asthe light moves.It is as if a great number of spirits are laughing at me.
855,Page 4,"Eventually those shadows pounce on me.The bodiless beings bind my hands and feet, and corner me until I am unableto move."
856,Page 5,I cannot speak.
857,Page 6,"One long shadow extends a tentacle towards my neck.Please stop,I implore."
858,Page 7,"I hold my both of my palms up, but the shadow passes through the areasbetween my fingers and reaches my neck.I try to speak but only a gasp comes out that will not reach Cybil."
859,Page 8,"Finally, activity in my brain begins to stop due to a lack of oxygen.I saw stars in my eyes and then nothing at all. I lost consciousness as ifI were just going to sleep.第十章　「骨董屋」「冷え切った身体」Chapter 10   ""Antique Shop""Frozen body"
860,Page 9,..................
861,Page 10,My body is freezing.Where am I...?I cannot focus my eyes.
862,Page 11,That's right...this is the antique shop...I am sitting on the floor with my back against the cold wall. I must havedozed off for a bit.My fingers are as cold as ice and so I cannot move them normally.
863,Page 12,"While chasing around after Cheryl fatigue must have been building up withoutme realizing it.However, this is no time to be sleeping."
864,Page 13,"Oh, I wonder how Cybil is doing?I look around the room and see that the eerie passage that was hidden behindthe shelf is still open just as it was before."
865,Page 14,"Cybil is still in there.When she comes out I will have a word with her...I hope she is ok.It seems like quite a bit of time has passed.第十章　「骨董屋」「銃弾は残り３発」Chapter 10   ""Antique Shop""Only three bullets remain"
866,Page 15,I heavily stand and check the gun in my pocket. I then stand at the entranceof the completely dark passage.I have only three bullets left.I cannot afford to waste any.
867,Page 16,"My breathing breaks the silence.I get out the gun and hold it near my temple, with it aimed at the stomachof that dark demon, and then I begin to walk forward.I am worried about Cybil's safety, so I am guided forward by my quivering feet."
868,Page 17 (Black),After walking for a bit I sensed light coming from somewhere other than theflashlight on my chest.I leisurely turn off my flashlight and see that something is shining atthe end of the passage.
869,Page 18,"I rush forward.I am running toward the light, not unlike how a small insect would.Something is there.Is Cybil all right?Or will I have to confront a monster again?第十章　「骨董屋」「眩い光」Chapter 10   ""Antique Shop""Dazzling light"
870,"Page 19 (Altar in the other church, flame is burning)",There was a room at the end of the passage.As I enter the room the light is so dazzlingly bright that I have to shieldmy eyes with the back of my hand.
871,Page 20,There is a simple altar on the wall to the right of where I entered the room.A large flame is coming off of a thick candle and green smoke is billowingfrom it.Everything in the room was shaking in the light from that flame.
872,Page 21,"""What...is this place...?""Once my eyes adjusted to the light my line of sight jumped to anunbelievable sight."
873,"Page 22 (Cybil, dead on the floor)","At first, I thought it was just a well made doll.A mannequin with a red shirt on...It was on its back, lying in a pool of red liquid.But...I soon understood what it was."
874,Page 23,Cybil.I softly call to her.Her light green shirt had been stained crimson by the flow of red liquid fromthe back of her neck.
875,Go to 10-22,"_______________________________________________________________________________第十章　　「骨董屋」        　                　  　　　　                10-22屍と化したシビル                                    (Altar in the other church)Chapter 10   ""Antique Shop""Cybil has become a corpse"
876,"Page 1 (Cybil, dead on the floor)",I was completely confused.A ) Rush to Cybil's side.
877,Go to 10-23,B ) Step back and run away.
878,Go to 10-24,"_______________________________________________________________________________第十章　　「骨董屋」        　                　  　　　　                10-23シビルに駆け寄るハリー                              (Altar in the other church)Chapter 10   ""Antique Shop""Harry rushes to Cybil's side"
879,"Page 1 (Cybil, dead on the floor)","""...Cybil....Cybil! Hold on!""I shake her shoulders.But she does not respond."
880,Page 2,"""Why has this happened...!""I cover her dead body.Her cold body."
881,Page 3,Lost in hopelessness I lost consciousness again.
882,Go to 10-25,"_______________________________________________________________________________第十章　　「骨董屋」        　                　  　　　　                10-24後ずさるハリー                                      (Altar in the other church)Chapter 10   ""Antique Shop""Harry steps back"
883,"Page 1 (Cybil, dead on the floor)",Something is in this room...I became frightened and left.
884,Page 2 (Black),"I head back to the passage that I just came through.""Dam...Dammit...!""My flashlight won't turn on.It seems to be broken."
885,Page 3,I continue to run through the darkness.There is no source of light in front of or behind me to tell me which wayI am going.
886,Page 4,"After running for a bit I thought, was it really this far to the antique shop?Even though I am moving I do not feel like I am moving forward."
887,Page 5,I hallucinate that the corpse of Cybil is pulling at my feet and won't letgo...Perhaps I will end up running on this moving floor forever.
888,Page 6,Finally my consciousness grows distant and I fall to the cold hard floorand pass out once again...
889,Go to 10-25,"_______________________________________________________________________________第十章　　「病院」          　                　  　　　　                10-25リサの言葉                                         (Nightmare examination room)Chapter 10   ""Hospital""Lisa's words"
890,Page 1 (Black),...rry? Are you OK?Harry?Harry?..............................Where am I?Harry.Lisa...Then I'm in the hospital.
891,Page 2 (Nightmare examination room) (Lisa appears),"You were having a bad dream.Was I?Hey, you don't look too good.Are you OK?I'm fine.Nothing you need to worry about.Well, if you're sure....."
892,Page 3,Lisa......Do you know a woman named Dahlia Gillespie?
893,Page 4,"Oh yeah, that crazy Gillespie lady.She's kind of famous around here.She never sees anybody, so I don't know that much about her."
894,Page 5,"But I heard her kid died in a fire, and supposedly she's been crazyever since.Well, she says the town is being devoured by the darkness.Do you have any idea what she's talking about?"
895,Page 6,"The town...devoured by the darkness.Yes, I think I do.Before this place was turned into a resort, the townspeople here were onthe quiet side."
896,Page 7,"Everybody followed some kind of queer religion...Weird occult stuff...Black magic, that kind of thing."
897,Page 8,"As young people moved away, the people figured they'd been summoned bythe gods. Evidently, things like that used to happen around here all the time."
898,Page 9,"Before the resort, there wasn't really anything else out here.Everyone was so flipped out. Gotta blame it on something.Then a lot of new people came in and everybody clammed up about it."
899,Page 10 (Lisa looks down),"A cult...Last time I heard anything about it was, gosh, years ago...When several people connected with developing the town died in accidents.People said it was a curse."
900,Page 11,"Oh, I'm sorry. I'm rambling...I'll shut up................................No...it's all right."
901,Page 12,"Hey, Harry.What happened...to your hand...?Oh, this...I just hurt it a little bit."
902,Page 13,Is it OK?Yeah...just a scratch...Nothing major...Even if it is just a scratch there is a lot of blood...If we don't look after it soon...
903,Page 14,It's OK...Please don't touch it....Why are you so angry?...Sorry....But this does not concern you....I don't want to get you mixed up in this...
904,Page 15,"...I'm sorry...第十章　「骨董屋」「リサの言葉」Chapter 10   ""Antique Shop""Lisa's words"
905,Page 16 (Black),"The reverberation of Lisa's ""I'm sorry"" remained in my ears.I wonder how long had I been asleep? I found myself in that antique shopagain, lying face down in the same position I was in just a short while ago."
906,Page 17 (Antique shop),"Was that another dream?Did I pass out again?I don't want to think so, but maybe this is all just going on in my head."
907,Page 18,"I could have had a car accident, and now I'm lying unconscious in a hospitalbed...I don't know what's real anymore..."
908,Page 19,"Cybil's body has vanished.She is gone, almost as if she was absorbed into the concrete floor."
909,Page 20,Maybe Cybil never came here in the first place?Just what did I see...A hallucination? A delusion?
910,Page 21,I want to talk to Lisa.She knows something.She is holding some secret.I will go to see her.
911,Page 22,Keeping one hand on the wall to support myself I stumble out of the antiqueshop.
912,Go to 11-15,"_______________________________________________________________________________第十一章　　「再び病院」          　            　    　　                 11-1リサとの再開                                       (Nightmare examination room)Chapter 11   ""Hospital, Again""A reunion with Lisa"
913,Page 1 (Close up of metal grating floor),"Perhaps the caterpillar from before was blocking my path to the hospital, asmy route, which had been blocked until just before, was now restored."
914,Page 2,The entire town seemed like the insides of an enormous living thing.If a part of it is treated...then a part of it is destroyed.If a part of it disappears...then a part of it appears.I get the feeling that I am wandering about within a living organism thathas become a labyrinth.
915,Page 3 (Nightmare examination room),"I open the gate to the hospital and then energetically open the doorof the examination room.Inside Lisa was waiting for me.第十一章　「再び病院」「駆け寄ってくるリサ」Chapter 11   ""Hospital, Again""Lisa rushes to Harry"
916,Page 4 (Lisa appears),"""Harry!""She changes from looking completely exhausted and rushes over to me in aninnocent, childlike way."
917,Page 5,"""Glad you're OK.""""Thank God you came back.I was scared to be here all alone.""""I'm here now. I was worried, too.I'm real happy to see you."""
918,Page 6,I lightly hug Lisa and gently draw away. I then speak while looking intoher eyes.
919,Page 7,"""Lisa, can you tell me how to get to the lake?""""The lake? You take Bachman Road.""""The road's blocked.""I recall what Cybil told me."
920,Page 8,"""Well, that's the only way out there.""""Are you sure?There's gotta be another way.""Lisa places her hand on her chin and thinks for a bit. Then her eyes openwide as if she has realized something."
921,Page 9,"""Wait, I just remembered something.""""What?"""
922,Page 10,"""There's a water works over by my old elementary school.It's been abandoned for years.There's an underground tunnel out there used for inspections, or something!I remember hearing it runs all the way to the lake!"""
923,Page 11,"""Really?! You think I can get to the lake from there?""""I've never been down in there myself, so I'm not positive.Besides, it's all fenced off to keep people out."""
924,Page 13,"""If there's a chance, I've got to try.""Lisa embraces me again just as I think that her face is beginning to looktearful."
925,Page 14,"""Harry, don't go!I don't want to be alone.It's so scary I can't stand it."""
926,Page 15,"This one room in an empty hospital.In this state in which monsters could kick in the door and enter at any time,she has no weapons with which to defend herself with.So her being gripped with fear is only natural."
927,Go to 11-2,"_______________________________________________________________________________第十一章　　「再び病院」          　            　    　　                 11-2行かないで、とリサ                                 (Nightmare examination room)Chapter 11   ""Hospital, Again""Lisa says ""Don't go"""
928,Page 1 (Nightmare examination room) (Lisa appears),What should I do?A ) Take Lisa with me.
929,Go to 11-3,B ) Leave Lisa here.
930,Go to 11-4,"_______________________________________________________________________________第十一章　　「再び病院」          　            　    　　                 11-3一緒に行こう、とハリー                             (Nightmare examination room)Chapter 11   ""Hospital, Again""Harry says ""Come with me"""
931,Page 1 (Nightmare examination room) (Lisa appears),"I speak.""How about coming with me?This may not be the safest place in the world either. I can't promise youanything, but I'll do my best to protect you."""
932,Page 2 (Lisa looks down),"""No...somehow I feel I'm not supposed to leave this place.Oh, Harry, I'm so scared...I'm cold."""
933,Page 3,"I waver. Is it ok for me to leave Lisa alone...But then, what will happen to Cheryl?Cheryl has only me to depend on.My concern for Cheryl cannot be compared with my concern for Lisa.After all...she is my daughter."
934,Page 4,"""Look, just wait here a little longer.I'll be back as soon as I find my daughter.""Perhaps those words rang cold for Lisa.But there is nothing that can be done.I must save my daughter.""Harry..."""
935,Go to 11-5,"_______________________________________________________________________________第十一章　　「再び病院」          　            　    　　                 11-4無理だ、とハリー                                   (Nightmare examination room)Chapter 11   ""Hospital, Again""Harry says ""I can't"""
936,Page 1 (Nightmare examination room) (Lisa appears),"I waver. Is it ok for me to leave Lisa alone...But then, what will happen to Cheryl?Cheryl has only me to depend on.My concern for Cheryl cannot be compared with my concern for Lisa.And no matter what she is my daughter."
937,Page 2,"""Look, just wait here a little longer.I'll be back as soon as I find my daughter.""Perhaps those words rang cold for Lisa.But there is nothing that can be done.I must save my daughter.""Harry......"""
938,Go to 11-5,"_______________________________________________________________________________第十一章　　「ビル給水塔」        　            　    　　                 11-5成虫と化した化け物                            (Close up of metal grating floor)Chapter 11   ""The Water Tower on the Building""The matured monster"
939,Page 1 (Close up of metal grating floor),I leave the hospital.The water supply installation near the elementary school...I was told that I could go through those sewers and reach the lake that Cherylwas heading toward.I must hurry.
940,Page 2,"As I began to run I felt something fly over my head.It looks like something is flying in circles in the sky above me, but itis dark so I cannot see it so well.I climb the metal stairs of the building across the street, and then head upto the roof."
941,Page 3 (Close up of Float Stinger),"""What...what is this...?""A giant moth...I guess I didn't completely kill it. That caterpillar that I shot at theTown Center has followed me here."
942,"Page 4 (Float Stinger, animated)","And it has matured. It dances against the black sky and is looking down on me.In addition to the poison that it can discharge from its mouth, it now hasa stinger with which to stick me with."
943,Go to 11-6,"_______________________________________________________________________________第十一章　　「ビル給水塔」        　            　    　　                 11-6ここで息の根を…                              (Close up of metal grating floor)Chapter 11   ""The Water Tower on the Building""I must kill it here..."
944,"Page 1 (Float Stinger, animated)",I'm in danger...!A ) Fire the rifle while avoiding it.
945,Go to 11-7,B ) Hide in the shadows of the buildings.
